{
  "schema_version": 1,
  "framework_version": "0.1.0",
  "run_id": "6cbb794c5f1d-fix-config-typo-0",
  "task_id": "file-editing/fix-config-typo",
  "task_version": "1.0.0",
  "task_protocol_version": 1,
  "agent": "scripted",
  "agent_config": {
    "script": [
      {
        "tool": "read_file",
        "args": {
          "path": "config.ini"
        }
      },
      {
        "tool": "patch_file",
        "args": {
          "path": "config.ini",
          "search": "timout",
          "replace": "timeout"
        }
      }
    ]
  },
  "success": true,
  "partial_success": false,
  "score": {
    "total": 1.0,
    "components": {
      "typo removed": 1.0,
      "correct key present": 1.0
    },
    "weights": {
      "typo removed": 1.0,
      "correct key present": 1.0
    }
  },
  "failure_reason": "none",
  "failure_detail": "no_failure",
  "steps": 3,
  "tool_calls": 2,
  "failed_tool_calls": 0,
  "invalid_tool_calls": 0,
  "repeated_calls": 0,
  "unnecessary_changes": 0,
  "workspace_violations": 0,
  "test_pass_ratio": null,
  "wall_ms": 1.584,
  "model_ms": null,
  "tool_ms": 1.274,
  "usage": {
    "tokens": null,
    "model_time_ms": null,
    "provider_cost_reported": null,
    "currency": null
  },
  "trust_state": "LOCAL",
  "judge_config": null,
  "started_at": "2026-08-26T11:05:26.792242+00:00",
  "finished_at": "2026-08-26T11:05:26.795886+00:00",
  "bundle_path": null
}