{
  "schema_version": 1,
  "framework_version": "0.1.0",
  "run_id": "82cf39591e1c-users-to-csv-0",
  "task_id": "json-csv-transform/users-to-csv",
  "task_version": "1.0.0",
  "task_protocol_version": 1,
  "agent": "scripted",
  "agent_config": {
    "script": [
      {
        "tool": "write_file",
        "args": {
          "path": "users.csv",
          "content": "name,age\nAda,36\nLin,28\n"
        }
      }
    ]
  },
  "success": true,
  "partial_success": false,
  "score": {
    "total": 1.0,
    "components": {
      "csv created": 1.0,
      "csv content exact": 1.0
    },
    "weights": {
      "csv created": 1.0,
      "csv content exact": 1.0
    }
  },
  "failure_reason": "none",
  "failure_detail": "no_failure",
  "steps": 2,
  "tool_calls": 1,
  "failed_tool_calls": 0,
  "invalid_tool_calls": 0,
  "repeated_calls": 0,
  "unnecessary_changes": 0,
  "workspace_violations": 0,
  "test_pass_ratio": null,
  "wall_ms": 1.119,
  "model_ms": null,
  "tool_ms": 0.956,
  "usage": {
    "tokens": null,
    "model_time_ms": null,
    "provider_cost_reported": null,
    "currency": null
  },
  "trust_state": "LOCAL",
  "judge_config": null,
  "started_at": "2026-08-22T16:08:13.506918+00:00",
  "finished_at": "2026-08-22T16:08:13.510430+00:00",
  "bundle_path": null
}